{
  "$schema": "https://github.com/pytincture/pytincture/contracts/qualification-evidence-v1.schema.json",
  "artifact_files": {
    "npm": "pytincture-runtime-1.0.0-rc.15.tgz",
    "sdist": "pytincture-1.0.0rc15.tar.gz",
    "wheel": "pytincture-1.0.0rc15-py3-none-any.whl"
  },
  "artifact_sha256": {
    "npm": "effeb49c56f8d3b23674ab75c4037f20617cf8d960cc1d9ef219889c417287de",
    "sdist": "37cbf624ae9d1c922396df5bb754f8560db9d31e2c1c490637d54ab1260a7972",
    "wheel": "f1ae8964a21ad746aade0f8dcffd352d23f9563762c08d7d0f4bfdfef7c76fa2"
  },
  "commit_sha": "72aad0857936f872b256804dff9ffbd523624b68",
  "evidence_url": "https://github.com/pytincture/pytincture/actions/runs/38427355625",
  "exercise": "authenticated_bff",
  "npm_version": "1.0.0-rc.15",
  "result_sha256": {
    "browser": "fdae276790bcdfd4560aab0b829d12636b0dad73262cfda088967ac69b197aec"
  },
  "results": {
    "browser": {
      "authenticated_bff_p95_ms": 8.2,
      "authenticated_bff_samples_ms": [
        8.2,
        7.8,
        7.2,
        92.8,
        7.7,
        6.6,
        6.3,
        6.2,
        5.9,
        6.2,
        6.4,
        6.1,
        6.1,
        6.2,
        5.9,
        5.8,
        5.9,
        5.8,
        6.3,
        5.6
      ],
      "browser": "chromium",
      "cold_authenticated_start_ms": 3570,
      "status": "passed",
      "warm_authenticated_start_ms": 2266
    }
  },
  "run": {
    "attempt": 1,
    "event": "push",
    "id": "38427355625",
    "job": "browser-e2e",
    "ref": "refs/heads/main"
  },
  "schema_version": 1,
  "status": "passed",
  "tested_at": "2026-10-13T16:05:46Z",
  "version": "1.0.0rc15"
}
