{
  "$schema": "https://github.com/pytincture/pytincture/contracts/qualification-evidence-v1.schema.json",
  "artifact_files": {
    "npm": "pytincture-runtime-1.0.0-rc.15.tgz",
    "sdist": "pytincture-1.0.0rc15.tar.gz",
    "wheel": "pytincture-1.0.0rc15-py3-none-any.whl"
  },
  "artifact_sha256": {
    "npm": "effeb49c56f8d3b23674ab75c4037f20617cf8d960cc1d9ef219889c417287de",
    "sdist": "37cbf624ae9d1c922396df5bb754f8560db9d31e2c1c490637d54ab1260a7972",
    "wheel": "f1ae8964a21ad746aade0f8dcffd352d23f9563762c08d7d0f4bfdfef7c76fa2"
  },
  "commit_sha": "72aad0857936f872b256804dff9ffbd523624b68",
  "evidence_url": "https://github.com/pytincture/pytincture/actions/runs/38427355625",
  "exercise": "performance_service",
  "npm_version": "1.0.0-rc.15",
  "result_sha256": {
    "appcode": "de5fa0739121a71aa90febb0ac1e05fd31524c64bfed2562cbd4a2805ea9cbe0",
    "bff": "9c49fa62128e8213fa82b0d631633c98a1cc6ded5a39de775b0e686ef99855ab",
    "health": "7fe93f263182c0deb483163cf8dd9252fa3e64216a859358b1ce44b8a72fb655",
    "public_asset": "88b1430f3300d95620585fa0ac167164c53f3180616dab5f160f305bb5b32847",
    "public_asset_head": "65c04994509129d19989647aabc9b908a88758847a12d619b86417b80ae854d2",
    "saturation": "cb16d426d57363fe9c4694d9efb9e7ca098b1129e2fcdeb62e8cfa17b7f3c58e"
  },
  "results": {
    "appcode": {
      "concurrency": 5,
      "failures": 0,
      "latency_ms": {
        "max": 80.104,
        "mean": 36.336,
        "p50": 32.053,
        "p95": 68.752
      },
      "method": "GET",
      "p95_budget_ms": 1500.0,
      "requests": 40,
      "requests_per_second": 133.32,
      "url": "http://127.0.0.1:8081/e2e_app/appcode/appcode.pyt"
    },
    "bff": {
      "concurrency": 10,
      "failures": 0,
      "latency_ms": {
        "max": 82.327,
        "mean": 65.064,
        "p50": 66.128,
        "p95": 69.294
      },
      "method": "POST",
      "p95_budget_ms": 500.0,
      "requests": 200,
      "requests_per_second": 150.89,
      "url": "http://127.0.0.1:8081/performance_data/classcall/performance_data.py/PerformanceData/ping"
    },
    "health": {
      "concurrency": 20,
      "failures": 0,
      "latency_ms": {
        "max": 30.307,
        "mean": 25.953,
        "p50": 25.976,
        "p95": 28.393
      },
      "method": "GET",
      "p95_budget_ms": 500.0,
      "requests": 500,
      "requests_per_second": 750.94,
      "url": "http://127.0.0.1:8081/healthz"
    },
    "public_asset": {
      "concurrency": 2,
      "failures": 0,
      "latency_ms": {
        "max": 84.038,
        "mean": 80.946,
        "p50": 78.915,
        "p95": 84.038
      },
      "method": "GET",
      "p95_budget_ms": 5000.0,
      "requests": 4,
      "requests_per_second": 24.28,
      "url": "http://127.0.0.1:8081/e2e_app/appcode/dhxpyt-0.9.18+backend-py3-none-any.whl"
    },
    "public_asset_head": {
      "concurrency": 5,
      "failures": 0,
      "latency_ms": {
        "max": 50.871,
        "mean": 35.337,
        "p50": 34.303,
        "p95": 46.617
      },
      "method": "HEAD",
      "p95_budget_ms": 750.0,
      "requests": 20,
      "requests_per_second": 134.57,
      "url": "http://127.0.0.1:8081/e2e_app/appcode/dhxpyt-0.9.18+backend-py3-none-any.whl"
    },
    "saturation": {
      "concurrency": 15,
      "minimum_overload_rejections": 1,
      "overload_rejections": 18,
      "recovery": {
        "bff_latency_ms": 5.262,
        "bff_status": 200,
        "health_latency_ms": 1.629,
        "health_status": 200
      },
      "recovery_budget_ms": 500.0,
      "requests": 30,
      "statuses": {
        "200": 12,
        "503": 18
      }
    }
  },
  "run": {
    "attempt": 1,
    "event": "push",
    "id": "38427355625",
    "job": "production-smoke",
    "ref": "refs/heads/main"
  },
  "schema_version": 1,
  "status": "passed",
  "tested_at": "2026-10-13T16:04:53Z",
  "version": "1.0.0rc15"
}
